{
  "schema_version": "autocontract.reorder-final-oracle.v0",
  "artifact_type": "reorder_private_oracle",
  "benchmark_id": "replace-with-benchmark-id",
  "public_manifest_sha256": "0000000000000000000000000000000000000000000000000000000000000000",
  "commitment_salt_hex": "0000000000000000000000000000000000000000000000000000000000000000",
  "annotators": [
    {"annotator_id": "primary-id", "role": "primary", "independent_of_analyzer": true, "conflict_disclosure": "replace-disclosure"},
    {"annotator_id": "reviewer-id", "role": "reviewer", "independent_of_analyzer": true, "conflict_disclosure": "replace-disclosure"}
  ],
  "units": [{
    "pair_id": "replace-pair-id", "primary_label": "unknown", "reviewer_label": "unknown", "adjudicated_label": "unknown",
    "confidence": "low", "proof_kind": "unresolved", "rationale": "Replace with at least twenty characters of private reasoning.",
    "premises": [], "evidence_anchors": ["replace-private-evidence-anchor"], "counterexample": null, "reviewed_by": ["reviewer-id"]
  }],
  "adjudication": {"status": "complete", "disagreement_count": 0, "record_sha256": "0000000000000000000000000000000000000000000000000000000000000000"}
}
